source,Headline,Body,Relevancy
https://t.co/n2zeoV1okr,Senior Site Reliability Engineer (m/f) — GitHub Jobs,"Full Time / Munich The Westwing mission is to inspire and make every home a beautiful home. We are on a quest to bring the wonders of eCommerce for home & living to our more than 1,000,000 customers in 14 countries on three continents. In less than 7 years on the market, we have grown to more than 266 million Euros in annual sales. More importantly, the opportunity ahead of us is massive. The Westwing team is the secret to our success. Our more than 1,400 team members balance creativity and style with innovative technology and strong business fundamentals. We are proud to be working with inspiring colleagues who are smart, fun, ambitious, and looking for the challenge to transform an industry and take it into the future. Do you think this could be you? To pursue our ambitious growth strategy, we are looking for a Senior Site Reliability Engineer (m/f). In this position, you will be responsible for continuing to build out a first-class, innovative team embodying the Site Reliability Engineering philosophy and methodology. Your responsibilities will be: You come with: We offer: Interested? Looking forward to your full application under specification of your possible starting date and salary expectation. Apply now Westwing Group GmbH - Miriam Rabung - Moosacher Straße 88, 80809 Muenchen jobs@westwing.de www.westwing.de https://www.westwing.de/joblist/#oI1o7fwY © 2018 GitHub Inc. All rights reserved.",85.9312906151
https://t.co/BkonC3k31l,Stichtag 25.05.2018 - Kundenumfrage zeigt: 79% der Unternehmen haben erhebliche finanzielle Einbußen durch Datenschutzgrundverordnung der EU (DSGVO) | Datensicherheit und IT Security - Nachrichten,"Unternehmen erhalten derzeit diverse Beraterangebote, die die fehlende Expertise vieler Unternehmer im Bereich des Datenschutzes ausnutzen und äußerst kostspielig sind. Zudem ist die Umsetzung der Verordnung mit einem enormen Zeitaufwand verbunden. ""Ich war selbst über die drastischen Reaktionen zahlreicher Unternehmer überrascht. Viele der Unternehmen, die bisher keine erhöhten Kosten wahrnehmen, scheinen sich den anstehenden Herausforderungen nicht bewusst zu sein."" so Joachim Haedke, Geschäftsführer der Finanzierung.com GmbH. ""Ich bezweifle, dass alle deutschen Bundestagsabgeordneten ihren Datenverkehr bereits DSGVO-konform führen, sonst wären vermutlich schon Maßnahmen getroffen worden, um diese Tortur zu stoppen."" Die Datenschutzgrundverordnung (DSGVO) ist eine EU-weite Vereinheitlichung und Neuregelung der Datenschutzrichtlinien, die sowohl Unternehmen, als auch Verbände, Institutionen und Vereine betrifft. Unter anderem wird der gesamte Umgang mit personenbezogenen Daten neu geregelt und erschwert. Die Verordnung stößt europaweit auf heftige Kritik aus der Wirtschaft. Original-Content von: Finanzierung.com GmbH, übermittelt durch news aktuell",72.5678549432
https://t.co/X2gc2ieAFH,"TMJ-GER Recruit Jobs auf Twitter: ""We're #hiring! Read about our latest #job opening here: Talent Acquisition Sr. Analyst / Recruiter - https://t.co/qTMPltJuAw #DellJobs #Recruiting #Munich, BY #CareerArc""","In deinem Browser ist JavaScript deaktiviert. Möchtest du mit dem klassischen Twitter weitermachen? Ja Hier ist die URL für diesen Tweet. Einfach kopieren und mit Freunden teilen. Auf deiner Timeline findest du in Echtzeit die Informationen, die dir wichtig sind. Um einem Account zu entfolgen, Cursor zum Profilbild bewegen und Folgen-Button klicken. Wenn du einen Tweet siehst, den du magst, dann klicke das Herz und zeige damit dem Verfasser, dass dir der Tweet gefällt. Der schnellste Weg, den Tweet eines anderen mit deinen Followern zu teilen, ist ein Retweet. Tippe auf das Symbol, um ihn sofort zu retweeten. Teile deine Gedanken zu einem Tweet ganz einfach in einer Antwort mit. Finde ein Thema, das dich interessiert, und leg direkt los. Erhalte einen aktuellen Überblick, worüber sich andere zur Zeit unterhalten. Folge mehr Accounts, um sofort Updates zu Themen zu bekommen, die dir wichtig sind. Sieh sofort die neuesten Unterhaltungen zu jedem Thema. Lass dir keine der besten Geschichten entgehen, während sie passieren.  Zurück zum Anfang ↑",85.7592621982
https://t.co/5Am3BQyhnT,Umschuldung: Verbraucher werden teure Altkredite los (FOTO) | Kredite und Baufinanzierung - Nachrichten,"Umschuldung des bestehenden Ratenkredits spart über 2.000 Euro Nur wenige Konsumentenkredite für Reisen oder Technik Verbraucher, die Fragen zu einem Konsumentenkredit haben, erhalten bei den über 200 CHECK24-Kreditexperten an sieben Tagen die Woche eine persönliche Beratung per Telefon oder E-Mail. Im Kreditcenter haben Kunden ihre Darlehen im Blick, können neue Anfragen starten und das passende Angebot digital abschließen. Über CHECK24 CHECK24 ist Deutschlands größtes Vergleichsportal. Der kostenlose Online-Vergleich zahlreicher Anbieter schafft konsequente Transparenz und Kunden sparen durch einen Wechsel oft einige hundert Euro. Privatkunden wählen aus über 300 Kfz-Versicherungstarifen, über 1.000 Strom- und über 850 Gasanbietern, mehr als 30 Banken, über 250 Telekommunikationsanbietern für DSL und Mobilfunk, über 5.000 angeschlossenen Shops für Elektronik, Haushalt und Autoreifen, mehr als 150 Mietwagenanbietern, über 1.000.000 Hotels, mehr als 700 Fluggesellschaften und über 90 Pauschalreiseveranstaltern. Die Nutzung der CHECK24-Vergleichsrechner sowie die persönliche Kundenberatung an sieben Tagen die Woche ist für Verbraucher kostenlos. Von den Anbietern erhält CHECK24 eine Vergütung. Das Unternehmen CHECK24 beschäftigt gut 1.000 Mitarbeiter gruppenweit mit Hauptsitz in München. Original-Content von: CHECK24 GmbH, übermittelt durch news aktuell",80.0775992426
https://t.co/QcV0sXuVjK,"MacMagazine.com.br auf Twitter: ""iOS 12 deverá abrir mais o chip NFC de iPhones » https://t.co/Z1V1c7GMrx (por @rfischmann)… ""","In deinem Browser ist JavaScript deaktiviert. Möchtest du mit dem klassischen Twitter weitermachen? Ja Hier ist die URL für diesen Tweet. Einfach kopieren und mit Freunden teilen. Auf deiner Timeline findest du in Echtzeit die Informationen, die dir wichtig sind. Um einem Account zu entfolgen, Cursor zum Profilbild bewegen und Folgen-Button klicken. Wenn du einen Tweet siehst, den du magst, dann klicke das Herz und zeige damit dem Verfasser, dass dir der Tweet gefällt. Der schnellste Weg, den Tweet eines anderen mit deinen Followern zu teilen, ist ein Retweet. Tippe auf das Symbol, um ihn sofort zu retweeten. Teile deine Gedanken zu einem Tweet ganz einfach in einer Antwort mit. Finde ein Thema, das dich interessiert, und leg direkt los. Erhalte einen aktuellen Überblick, worüber sich andere zur Zeit unterhalten. Folge mehr Accounts, um sofort Updates zu Themen zu bekommen, die dir wichtig sind. Sieh sofort die neuesten Unterhaltungen zu jedem Thema. Lass dir keine der besten Geschichten entgehen, während sie passieren.  Zurück zum Anfang ↑",86.7982059096
https://t.co/ZbHlkhNuN9,"Das Erste: ""Die beste Klasse Deutschlands"": Wer gewinnt das größte Schülerquiz 2018? (FOTO) | Schulen - Nachrichten","Am Superfinal-Samstag, 26. Mai, entscheidet sich um 10:00 Uhr im Ersten, welche Klasse den Titel mit nach Hause nimmt Ins Rennen geht außerdem die 6.2 der Schule an der Telemannstraße aus Leipzig. Ferenz darf als Klassenbester in der ersten Reihe sitzen, unterstützt von Mitschüler Simon und zwei Plüschäffchen namens Bob und Bobby. ""Wir sind kreativ, innovativ und positiv. Damit holen wir den Pokal!"", ist sich die Klasse sicher. Welche Klasse noch ihr Ticket ins Finale ergattert, zeigt sich am Freitag, dem 25. Mai um 19:30 Uhr bei KiKA. Beim Superfinale sorgt Moderator Malte Arkona mit spannenden Quizfragen und kniffeligen Aufgaben für Nervenkitzel: ""Für mich ist 'Die beste Klasse Deutschlands' die schnellste und spannendste Quizshow im deutschen Fernsehen, und ich bin schon jetzt gespannt, wer bei den kniffligen Fragen und Experimenten im Superfinale die Nase vorn haben wird."" Viele prominente Gäste, die die Schulbank hinter sich gelassen haben, sind mit von der Partie: Tischtennis-Legende Timo Boll steht Bürger Lars Dietrich in einem packenden Match gegenüber. ""Ich finde es klasse, dass den Schülern spielerisch Wissen vermittelt wird. Es macht mich stolz, dabei mitwirken zu können"", freut sich der Entertainer. Schauspielerin Luise Befort (""Club der roten Bänder"") steht im wahrsten Sinne des Wortes unter Strom. Sie ist nämlich Teil eines ganz besonderen Experiments: ""Es ist für mich etwas ganz Besonderes, Teil der Sendung zu sein, weil ich Malte und Ralph früher schon großartig fand, und es super ist, dass ich jetzt mit den beiden vor der Kamera experimentieren darf."" Außerdem gibt Fußballstar Manuel Neuer den Schulklassen Tipps - direkt vom Fußballplatz. Moderator Ralph Caspers geht zwischen 40 Wasserkanistern seiner Leidenschaft für spannende Experimente nach und YouTuber Phil Laude testet mit Kim Unger eine originelle Marshmallow-Kanone. Moderatorin Jeannine Michaelsen meldet sich während der Sendung mit spannenden Facts und unterhaltsamen Geschichten aus Edinburgh und versucht sich im Baumstammwerfen. LEA, die mit ihrem Song ""Leiser"" gerade die Charts stürmt, sorgt musikalisch für noch mehr Stimmung im Studio. Für den 10-jährigen Joshua aus Kirchheim wird ein Traum wahr: Er darf Malte im Superfinale unterstützen und den begehrten Pokal für ""Die beste Klasse Deutschlands"" 2018 ins Studio tragen. Das beliebte Schülerquiz wird in diesem Jahr zehn Jahre alt - am 19. März 2008 feierte ""Die beste Klasse Deutschlands"" Premiere beim Kinderkanal von ARD und ZDF. Das bedeutet insgesamt 265 Sendungen, 3.140 Quizfragen, 561 Experimente und über 2.200 kg Spaghetti, die in den letzten zehn Jahren von 352 Klassen verputzt wurden. ""Die beste Klasse Deutschlands: Superfinale"" am 26. Mai 2018, um 10:00 Uhr im Ersten Wiederholung: KiKA, Freitag, 1. Juni, 19:30 Uhr Pressefotos über ard-foto.de, Audio/Video-Clips stehen auf Nachfrage bereit. Original-Content von: ARD Das Erste, übermittelt durch news aktuell",85.6490326713
https://t.co/rMXL0WGqfv,"erik spiekermann auf Twitter: ""Wer den @krautreporter als gedruckte Zeitung haben will: bitte Bescheid sagen, wir brauchen dann eure Anschrift für den Versand: https://t.co/pxhYsNeFj7
#letterpress #krautreporter #zeitung""","In deinem Browser ist JavaScript deaktiviert. Möchtest du mit dem klassischen Twitter weitermachen? Ja Typomaniac Hier ist die URL für diesen Tweet. Einfach kopieren und mit Freunden teilen. Auf deiner Timeline findest du in Echtzeit die Informationen, die dir wichtig sind. Um einem Account zu entfolgen, Cursor zum Profilbild bewegen und Folgen-Button klicken. Wenn du einen Tweet siehst, den du magst, dann klicke das Herz und zeige damit dem Verfasser, dass dir der Tweet gefällt. Der schnellste Weg, den Tweet eines anderen mit deinen Followern zu teilen, ist ein Retweet. Tippe auf das Symbol, um ihn sofort zu retweeten. Teile deine Gedanken zu einem Tweet ganz einfach in einer Antwort mit. Finde ein Thema, das dich interessiert, und leg direkt los. Erhalte einen aktuellen Überblick, worüber sich andere zur Zeit unterhalten. Folge mehr Accounts, um sofort Updates zu Themen zu bekommen, die dir wichtig sind. Sieh sofort die neuesten Unterhaltungen zu jedem Thema. Lass dir keine der besten Geschichten entgehen, während sie passieren. ich bin momentan kein Mitglied mehr, wirds die gedruckte auch im Shop geben zum Einzelkauf? Weiß ich nicht. Eher nein. Aber für 5 Euro im Monat kriegste jeden Tag die besten Artikel  Zurück zum Anfang ↑",90.1678197121
https://t.co/vZ8gBUTVIj,Kolumbien vor der Wahl: Das Land leidet weiterhin an den explosiven Folgen des Bürgerkriegs (FOTO) | Gemeinnützige Organisationen und NGOs - Nachrichten,"Räumung der Minen wird noch Jahrzehnte dauern ""Explosive Kriegsreste verhindern nach dem Krieg die sichere Rückkehr der Bevölkerung in ihr Zuhause"", erklärt Eva Maria Fischer, Leiterin der politischen Abteilung von Handicap International. ""In Kolumbien sind 31 von 32 Departamentos vermint. Wir sind mit mehreren Räumungs-Teams im Einsatz, doch es wird auch nach dem Friedensschluss noch Jahrzehnte dauern, bis alle explosiven Kriegsreste beseitigt sind"", so Fischer weiter. Die Expert/-innen von Handicap International veranstalten darüber hinaus Programme zur Gefahrenaufklärung über Minen und Blindgänger, um vor allem Kinder, die in den betroffenen Gebieten leben müssen, im Umgang mit der Gefahr zu schulen und somit die Zahl der Opfer zu verringern. Handicap International Original-Content von: Handicap International, übermittelt durch news aktuell",77.5483322837
https://t.co/LAiKLPD4jA,"GRIP - Das Motormagazin: ""JP Kraemer checkt den BMW i8 Roadster"" | Auto & Verkehr - Nachrichten","Sendetermin: Sonntag, 27. Mai 2018, um 18:00 Uhr bei RTL II Mallorca im Frühling - das perfekte Terrain, um ""oben ohne"" zu fahren. Fünf Jahre nach dem i8 Coupé schickt BMW die Roadster-Variante des Hybridsportlers auf die Straße. Mit verbesserter Akkutechnik und stärkerem Elektromotor kann das Cabrio 53 Kilometer weit rein elektrisch fahren - das Ganze zum Einstiegspreis von 155.000 Euro. JP Kraemer checkt, ob der i8 Roadster tatsächlich der Sportwagen der Zukunft ist. Zuschauerin Ramona sucht einen spritzigen Stadtflitzer, der zugleich ein hübsches Cabrio ist - ein ""Minicabrio"" sozusagen. Ramona hat nicht viel Geld zur Verfügung: Mehr als 5.000 Euro darf der offene Fahrspaß nicht kosten. GRIP-Gebrauchtwagenexperte Det Müller findet einen Ford Streetka, einen Opel Tigra und einen Smart Roadster. Ist der passende Flitzer für Ramona dabei? GRIP bei der Neuauflage der renommierten Oldie- und Youngtimer-Auktion im schweizerischen Toffen: Bei der großen Frühjahrsversteigerung kommen insgesamt 93 Traumautos unter den Hammer. Das Besondere: Viele davon werden ohne Mindestpreis angeboten. Das lockt gerade die Schnäppchenjäger an. Aber ob sie auch tatsächlich zu ihrem Traumwagen kommen? ""GRIP - Das Motormagazin"" am 27. Mai 2018 um 18:00 Uhr bei RTL II Über ""GRIP - Das Motormagazin"": Seit zehn Jahren und in über 400 Sendungen bietet ""GRIP - Das Motormagazin"" seinen Zuschauern sonntags um 18:00 Uhr bei RTL II kompetenten Motorjournalismus vereint mit Tests der Superlative. Mit viel Humor, einem hochwertigen Look und außergewöhnlichen Themen verbindet ""GRIP - Das Motormagazin"" Unterhaltung rund um die Motorwelt mit Service für den Verbraucher. Moderator Matthias Malmedie und sein Team zeigen jede Woche die heißesten Auto-Trends, wagen rasante Versuche und geben kompetente Tipps.",84.2158933121
https://t.co/UnhW3GVPaM,"Das Erste: Die 6/2 des Landesgymnasiums Latina August Hermann Francke aus Halle (Saale) ist ""Die beste Klasse Deutschlands"" 2018 (FOTO) | Schulen - Nachrichten","Wiederholung: ""Die beste Klasse Deutschlands: Superfinale"" bei KiKA, am Freitag, 1. Juni um 19:30 Uhr Original-Content von: ARD Das Erste, übermittelt durch news aktuell",54.1297831527
https://t.co/8e7ALJDl3R,Datenschutz-Jugendstudie von BRAVO und YouGov: Über die Hälfte haben von DSGVO gehört | Society und Tagesgeschehen - Nachrichten,"Große Wissens-Unterschiede über EU-Datenschutzgrundverordnung Datenschutz ist wichtig - Abmelden jedoch keine Option Über zwei Drittel (65 Prozent) der Befragten 14- bis 19-Jährigen halten das Thema Datenschutz für sich persönlich für wichtig. Abmelden von sozialen Netzwerken ist jedoch keine Option für die Befragten. Über ein Drittel (38 Prozent) stimmt den Nutzungsbedingungen zu, ohne die Änderungen zu lesen, und weitere 16 Prozent stimmen ohne zu lesen zu, da sie dem Dienst vertrauen. Jeder fünfte Befragte (21 Prozent) liest die Anpassungen, bevor er zustimmt. Jeder Siebte (14 Prozent) gibt an, er klicke sie einfach weg. BRAVO-Redaktionsleiterin Yvonne Huckenholz: ""Beim Thema Datenschutz ist der erste und wichtigste Schritt, sich darüber bewusst zu sein, was man absichtlich und auch unabsichtlich im Internet über sich preisgibt. Die Generation Z, also unsere Jugendlichen, besitzen hier eine deutlich größere Kompetenz als manch einer glaubt."" Nur sechs Prozent schützen ihre die Daten gar nicht. Drei von fünf Befragten (58 Prozent) haben private Profile, um nur Freunden Zugriff auf ihre persönlichen Informationen zu gestatten. Außerdem löscht die Hälfte (51 Prozent) regelmäßig den Browser-Verlauf, knapp die Hälfte (45 Prozent) deaktiviert sogar die Standortfunktion. Die Mehrheit (84 Prozent) der ""Digital Natives"" weiß, dass Apps und Internetseiten Zugriff auf ihre persönlichen Daten haben und diese speichern. Mehr als zehn Prozent der Jugendlichen sagen, es sei ihnen egal, da sie nichts zu verbergen hätten. Besonders die Mädchen (69 Prozent) stört dies im Vergleich zu den Jungen (51 Prozent). Sie nehmen es jedoch in Kauf, da sie die Dienste ansonsten nicht nutzen können. Die Umfrageergebnisse basieren auf der Erhebung Hinweis für die Redaktionen: Auszüge sind nur bei Nennung der Quelle ""Datenschutz-Jugendstudie von BRAVO und YouGov"" zur Veröffentlichung frei. Über BRAVO BRAVO gehört zur Bauer Media Group, eines der erfolgreichsten Medienhäuser weltweit. Über 700 Zeitschriften, mehr als 400 digitale Produkte und über 100 Radio- und TV-Stationen erreichen Millionen Menschen rund um den Globus. Darüber hinaus gehören Druckereien, Post-, Vertriebs- und Vermarktungsdienstleistungen zum Unternehmensportfolio. Mit ihrer globalen Positionierung unterstreicht die Bauer Media Group ihre Leidenschaft für Menschen und Marken. Der Claim ""We think popular."" verdeutlicht das Selbstverständnis der Bauer Media Group als Haus populärer Medien und schafft Inspiration und Motivation für die rund 11.500 Mitarbeiter in 17 Ländern. Über YouGov Original-Content von: Bauer Media Group, BRAVO, übermittelt durch news aktuell",87.9175446635
https://t.co/lCLQOVl3n7,"Dietmar Hölscher auf Twitter: ""So dann mal wieder #nopag 
Ich würde ja lieber im Biergarten sitzen, aber die #csu kommt mit einem bescheuerten Gesetz nach dem anderen daher.""","In deinem Browser ist JavaScript deaktiviert. Möchtest du mit dem klassischen Twitter weitermachen? Ja Hier ist die URL für diesen Tweet. Einfach kopieren und mit Freunden teilen. Auf deiner Timeline findest du in Echtzeit die Informationen, die dir wichtig sind. Um einem Account zu entfolgen, Cursor zum Profilbild bewegen und Folgen-Button klicken. Wenn du einen Tweet siehst, den du magst, dann klicke das Herz und zeige damit dem Verfasser, dass dir der Tweet gefällt. Der schnellste Weg, den Tweet eines anderen mit deinen Followern zu teilen, ist ein Retweet. Tippe auf das Symbol, um ihn sofort zu retweeten. Teile deine Gedanken zu einem Tweet ganz einfach in einer Antwort mit. Finde ein Thema, das dich interessiert, und leg direkt los. Erhalte einen aktuellen Überblick, worüber sich andere zur Zeit unterhalten. Folge mehr Accounts, um sofort Updates zu Themen zu bekommen, die dir wichtig sind. Sieh sofort die neuesten Unterhaltungen zu jedem Thema. Lass dir keine der besten Geschichten entgehen, während sie passieren.  Zurück zum Anfang ↑",90.1967644822
https://t.co/l4uIOpxuDu,"Über 25.000 Besucher: Perfekter Tour-Start für ""GRIP CARS &amp; COFFEE"" am ausverkauften Nürburgring (FOTO) | Auto & Verkehr - Nachrichten","Über die DAZ Verlagsgruppe: Über RTL II: Original-Content von: RTL II, übermittelt durch news aktuell",71.3854859281
https://t.co/KX918CGCD4,,"Reflecting on the creation process for that piece, I realised that most of the success stories I tapped into where from women. Not just women, but exceptional women making giant strides in the digital landscape. Regardless of this critical observation, I didn't want to lose my primary focus for that particular piece. But I did promise myself that I will devote time and effort towards discussing with some of these women; share their experiences – the highs and lows, successes and challenges along the way. It was my belief (and still is) that sharing bits and pieces from their individual stories could be helpful in providing direction to young people who are interested in defining a path for themselves in the digital space. How did your digital journey start? As an Entrepreneur, how has the experience been for you? What would you describe as your motiving factor(s)? What would you describe as your biggest challenge running your own business? Yamini: There is a lot I must say! For instance, setting up a business is quite a time-consuming and a bureaucracy infested process. Even more so when you are a non-EU citizen living in a country like Germany. The process can be quite exhausting, repetitive, and at times also dehumanising, but hey when in Rome.........? Opinion on the industry, trends, market and future? Advice for women who aspire to be in a position like you? ",100
https://t.co/aX1YRt9ZLz,IT Backend Specialist (f/m) — GitHub Jobs,Full Time / München Click here for the application form! © 2018 GitHub Inc. All rights reserved.,76.1495449651
https://t.co/I1TGfN93Io,"Das Erste / Start der diesjährigen ""FilmDebüt im Ersten""-Reihe / Zwölf Filme ab 29. Mai 2018, immer dienstags ab 22:45 Uhr | Programmankündigungen - Nachrichten","Die weiteren Filme und Sendetermine: 5. Juni 2018, 0:25 Uhr Therapie (BR) Von Felix Charin Mit Dominic Raacke, Taneshia Abt u. v. a. 12. Juni 2018, 00:35 Uhr Polder - Tokyo Heidi (SWR/SRF) Von Samuel Schwarz und Julian M. Grünthal Mit Nina Fog, Christoph Bach u.v.a. 19. Juni 2018, 01:10 Uhr Morris aus Amerika (SWR) Von Chad Hartigan Mit Markees Christmas, Craig Robinson u.v.a. 3. Juli 2018, 23:00 Uhr Die Hannas (SR/SWR/BR/ARTE) Von Julia C. Kaiser Mit Anna König, Till Butterbach u.v.a. 3. Juli 2018, 0:50 Uhr Ferien (RBB) Von Bernadette Knoller Mit Britta Hammelstein, Jerome Hirthammer, Inga Busch u.v.a. Alle Filme der Reihe stehen für akkreditierte Journalisten im Online-Vorführraum im Pressedienst Das Erste (Presse.DasErste.de) zur Ansicht bereit. Dort finden Sie auch die Pressemappe mit ausführlichen Informationen. Original-Content von: ARD Das Erste, übermittelt durch news aktuell",85.3923787482
https://t.co/yKH9NHlvZ6,"Svenja Schulze: Ich will Fahrverbote vermeiden / Bundesumweltministerin in der ADAC Motorwelt: ""Das Software-Update reicht nicht"" / Bündel an Maßnahmen erforderlich | Auto & Verkehr - Nachrichten","Generell fordert die Ministerin eine grundlegende Verkehrswende und setzt sich für einen Mix an Verkehrsträgern und Technologien ein. Erforderlich seien technisch intelligente Lösungen und alternative Strategien, damit der Verkehr umweltverträglicher werden könne. Intelligente Verkehrskonzepte, die mehr ÖPNV, mehr Transport auf der Schiene und mehr Carsharing ermöglichten, seien laut Schulze dafür notwendig. Das vollständige Interview mit Bundesumweltministerin Svenja Schulze erscheint am 25. Mai 2018 in der Juni-Ausgabe der ADAC Motorwelt. Die Clubzeitschrift ist mit einer Gesamtauflage von 13,5 Millionen Exemplaren und 14,8 Millionen Lesern Europas reichweitenstärkstes Einzelmedium. Original-Content von: ADAC, übermittelt durch news aktuell",67.3007242458
