source,Headline,Body,Relevancy
https://t.co/aNqYe04o4r,"
      AMD Job - 25975142 | CareerArc

    ",Preferred Qualifications: LI-BT1,100
https://t.co/iFyNltQ7AG,o2 Free Boost und o2 Free mit Connect: Doppeltes Datenvolumen zum kleinen Preis - Ein Tarif für alle vernetzten Geräte (FOTO) | Mobile Kommunikation - Nachrichten,"Das neue o2 Free Portfolio umfasst ab dem 5. Juni drei Tarife: Wie bisher gibt es den o2 Free S mit 1 GB Highspeed-Datenvolumen für 19,99 Euro monatlich und den Erfolgstarif o2 Free M mit 10 GB für nur 29,99 Euro im Monat. Beim neuen o2 Free L erhöht o2 bei unverändertem Preis von 39,99 Euro monatlich das Datenvolumen von 20 GB auf satte 30 GB. 60 GB für 44,99 Euro - Rundum-Sorglos-Datenpaket für den Massenmarkt Der o2 Free M bietet den Kunden mit Boost 20 GB für nur 34,99 Euro im Monat. Das Datenvolumen des o2 Free L Boost wächst zum günstigen Rundum-Sorglos-Datenpaket von 60 GB für attraktive 44,99 Euro im Monat. Die Welt vernetzter Alltagshelfer in einem Tarif Das üppige Datenvolumen der neuen o2 Free Tarife lässt sich ab dem 5. Juni ohne Zusatzkosten mit bis zu zehn mobilen Geräten über einen zentralen Tarif nutzen. Zum Beispiel werden Wearables immer beliebter und ergänzen das Smartphone durch ihre zusätzlichen Funktionen und intelligenten Sensoren. Mit der neuen o2 Free Funktion Connect ist jetzt nur noch ein Mobilfunkvertrag notwendig, da sich alle zugehörigen SIM-Karten das Highspeed-Datenvolumen des gewählten o2 Free Tarifs teilen. Ein Big Data Tarif für bis zu 10 Geräte ""Der Markt hatte bisher keine Lösung, all diese Endgeräte einfach und flexibel zu nutzen. Die neue o2 Free Funktion Connect ist eine innovative Lösung mit klarem Mehrwert für den Verbraucher in einer neuen Welt vernetzter Alltagshelfer. Damit revolutioniert Connect die Welt der smarten Geräte und verbindet diese mit den o2 Free Big Data-Tarifen. Mit noch mehr Daten und noch mehr Geräten setzen wir einen neuen Standard für die mobile Freiheit unserer Kunden"", sagt Metze. o2 Vorreiter bei disruptiven Mobilfunklösungen In keiner Marke von Telefónica Deutschland kristallisiert sich der Gedanke der Freiheit so sehr heraus wie bei o2: ""Wir sind der Pionier der Freiheit und stehen für kompromisslose Selbstbestimmung der Kunden. Das ist unsere klare strategische Ausrichtung und damit treffen wir den Nerv unserer Kunden"", so Metze. Die Reihe innovativer Lösungen für die Freiheit seiner Kunden setzt o2 jetzt mit seinen neuen Produkten im Rahmen der großen Freiheitsoffensive 2018 konsequent fort. ""Das Kundenversprechen ,Freiheit' wird auch künftig ohne Wenn und Aber das Handeln von o2 bestimmen. Unter dem Motto Freiheitsoffensive 2018 setzen wir unseren Kurs im Sinne unserer Kunden konsequent weiter fort. Unsere o2 Vertrags- und Prepaid-Kunden dürfen sich auf weitere Lösungen für ihren individuellen digitalen Lifestyle noch in diesem Jahr freuen"", kündigt Metze an. Pressestelle Telefónica Deutschland Original-Content von: Telefónica Deutschland Holding AG, übermittelt durch news aktuell",92.1782100138
https://t.co/BORSiGxoRB,"Das Erste: ""Bericht aus Berlin"" 
am Sonntag, 27. Mai 2018, um 18:30 Uhr im Ersten | Politik - Nachrichten","Geplante Themen: SPD Original-Content von: ARD Das Erste, übermittelt durch news aktuell",79.9935419373
https://t.co/augXyLbl93,Kraftstoff im Norden am billigsten / Deutlicher Anstieg in den vergangenen Wochen (FOTO) | Auto & Verkehr - Nachrichten,"Auch für Dieselfahrer ist Hamburg ein vergleichsweise günstiges Pflaster. Ein Liter kostet im Mittel 1,249 Euro, gefolgt von Schleswig-Holstein (1,252 Euro) und Bremen (1,265 Euro). Am teuersten tankt man Diesel derzeit in Baden-Württemberg (1,300 Euro), Rheinland-Pfalz (1,301 Euro) und im Saarland (1,315 Euro). Die Preisdifferenz zwischen dem günstigsten und teuersten Bundesland liegt bei 6,6 Cent. Die 50-Liter-Tankfüllung ist damit im Saarland um 3,30 Euro teurer als in Hamburg. Original-Content von: ADAC, übermittelt durch news aktuell",70.9938648405
https://t.co/lC9feSJf3W,"Stephan Rauhut auf Twitter: ""Preparing for the final #livrma #uclfinal #Klopp #youllneverwalkalone (@ Hochreiter Steirer Am Markt in Munich, Bavaria) https://t.co/iC90pQzPWp""","In deinem Browser ist JavaScript deaktiviert. Möchtest du mit dem klassischen Twitter weitermachen? Ja Politikwissenschaftler, tätig im Bereich Politikberatung; hier privat Hier ist die URL für diesen Tweet. Einfach kopieren und mit Freunden teilen. Auf deiner Timeline findest du in Echtzeit die Informationen, die dir wichtig sind. Um einem Account zu entfolgen, Cursor zum Profilbild bewegen und Folgen-Button klicken. Wenn du einen Tweet siehst, den du magst, dann klicke das Herz und zeige damit dem Verfasser, dass dir der Tweet gefällt. Der schnellste Weg, den Tweet eines anderen mit deinen Followern zu teilen, ist ein Retweet. Tippe auf das Symbol, um ihn sofort zu retweeten. Teile deine Gedanken zu einem Tweet ganz einfach in einer Antwort mit. Finde ein Thema, das dich interessiert, und leg direkt los. Erhalte einen aktuellen Überblick, worüber sich andere zur Zeit unterhalten. Folge mehr Accounts, um sofort Updates zu Themen zu bekommen, die dir wichtig sind. Sieh sofort die neuesten Unterhaltungen zu jedem Thema. Lass dir keine der besten Geschichten entgehen, während sie passieren.  Zurück zum Anfang ↑",91.5306333861
https://t.co/D55MRAaFpE,12. Deutscher Seniorentag 28. - 30. Mai / Wenn Seh- und Hörvermögen nachlassen: Geräte in anspruchsvollem Design gibt es auch mit komfortabler Bedienung (FOTO) | Mobile Kommunikation - Nachrichten,"Nützlich ist alles, was die Lebensqualität älterer Generationen erhält und verbessert. Sinnvoll ist, wenn Gerätebeschriftungen gut lesbar und beispielsweise ein Telefon hörgerätekompatibel ist. Ansonsten wollen die Älteren unter uns keine so genannten ""Seniorenmodelle"". Moderne Geräte werden solchen Ansprüchen oft nicht gerecht. Beispiel Telefone oder Smartphones: Sie werden zwar immer smarter, aber auch kleiner, komplexer und damit schwer bedienbar. Kann Telefonie nicht einfach sein und darüber hinaus zusätzlich Sicherheit bieten? Doch -kann sie. Man muss sich nur ausreichend informieren. Wenn ab einem gewissen Alter Komfortfunktionen eine Rolle spielen, dann sollte man auf folgende Punkte achten: Ein diesbezüglich beispielhaftes Modell ist das Gigaset E560A PLUS, eine Kombination aus Festnetztelefon mit Anrufbeantworter und Notruf-Freisprech-Clip. Dieser kann bequem am Gürtel getragen werden, fällt mit seinen 30 Gramm Gewicht und 8 cm Größe nicht weiter auf und eignet sich im Alltag zum Telefonieren, ohne dass das Schnurlostelefon in der Nähe sein muss. Im Fall der Fälle löst ein Tastendruck einen Notruf an bis zu vier voreingestellte Nummern aus. Hier zeigt sich, dass der Hersteller seit Jahren bei Forschung und Entwicklung die Merkmale Ergonomie, Komfort und Sicherheit besonders im Fokus hat. Das stellt er auch bei Telefonen der neuen Produktlinie ""life series"" unter Beweis. Original-Content von: Gigaset AG, übermittelt durch news aktuell",84.2967616685
https://t.co/mV8mslGaV1,CeBIT: Hotelpreise steigen zur weltgrößten IT-Messe um bis zu 133 Prozent (FOTO) | Hotels und Unterkünfte - Nachrichten,"Messenahe Übernachtung ab 324 Euro - knappe Hotelkapazitäten Messebesucher, die eine längere Anreise in Kauf nehmen, können aus 27 Hotels im Umkreis von zehn Kilometern zum Veranstaltungsort wählen. Das günstigste Doppelzimmer gibt es ab 245 Euro. Anbietervergleich spart bis zu 18 Prozent bei identischem Zimmer Persönliche Beratung per Telefon oder E-Mail durch CHECK24-Hotelexperten Kunden, die Fragen rund um die Hotelbuchung haben, erhalten bei den CHECK24-Hotelexperten an sieben Tagen in der Woche eine persönliche Beratung per Telefon oder E-Mail. Im digitalen Kundenkonto sehen und verwalten sie ihre Buchungen jederzeit. Über CHECK24 CHECK24 ist Deutschlands größtes Vergleichsportal. Der kostenlose Online-Vergleich zahlreicher Anbieter schafft konsequente Transparenz und Kunden sparen durch einen Wechsel oft einige hundert Euro. Privatkunden wählen aus über 300 Kfz-Versicherungstarifen, über 1.000 Strom- und über 850 Gasanbietern, mehr als 30 Banken, über 250 Telekommunikationsanbietern für DSL und Mobilfunk, über 5.000 angeschlossenen Shops für Elektronik, Haushalt und Autoreifen, mehr als 150 Mietwagenanbietern, über 1.000.000 Hotels, mehr als 700 Fluggesellschaften und über 90 Pauschalreiseveranstaltern. Die Nutzung der CHECK24-Vergleichsrechner sowie die persönliche Kundenberatung an sieben Tagen die Woche ist für Verbraucher kostenlos. Von den Anbietern erhält CHECK24 eine Vergütung. Das Unternehmen CHECK24 beschäftigt gut 1.000 Mitarbeiter gruppenweit mit Hauptsitz in München. Original-Content von: CHECK24 GmbH, übermittelt durch news aktuell",86.7552143416
https://t.co/zBuVavv3hQ,"Catharina Wilhelm auf Twitter: ""So, und heute Abend gibt‘s was auf die ... nein: von der Mütze! #Jazzliebe #GregoryPorter #NatKingCole (@ Philharmonie - @munich_phil in München, Bayern) https://t.co/zLjQichhBv… https://t.co/zBuVavv3hQ""","In deinem Browser ist JavaScript deaktiviert. Möchtest du mit dem klassischen Twitter weitermachen? Ja Hier ist die URL für diesen Tweet. Einfach kopieren und mit Freunden teilen. Auf deiner Timeline findest du in Echtzeit die Informationen, die dir wichtig sind. Um einem Account zu entfolgen, Cursor zum Profilbild bewegen und Folgen-Button klicken. Wenn du einen Tweet siehst, den du magst, dann klicke das Herz und zeige damit dem Verfasser, dass dir der Tweet gefällt. Der schnellste Weg, den Tweet eines anderen mit deinen Followern zu teilen, ist ein Retweet. Tippe auf das Symbol, um ihn sofort zu retweeten. Teile deine Gedanken zu einem Tweet ganz einfach in einer Antwort mit. Finde ein Thema, das dich interessiert, und leg direkt los. Erhalte einen aktuellen Überblick, worüber sich andere zur Zeit unterhalten. Folge mehr Accounts, um sofort Updates zu Themen zu bekommen, die dir wichtig sind. Sieh sofort die neuesten Unterhaltungen zu jedem Thema. Lass dir keine der besten Geschichten entgehen, während sie passieren.  Zurück zum Anfang ↑",90.8629195818
https://t.co/uOHWYtz5Ew,"Vom Biggest Loser zum Biggest Winner? Saki, Gewinner der SAT.1-Abnehmchallenge, setzt sein Preisgeld an der Börse ein | Aktien und Börse - Nachrichten","Über Guidants Original-Content von: BörseGo AG, übermittelt durch news aktuell",69.7813120642
https://t.co/UfSiAKkbOe,"TMJ-GER Retail Jobs auf Twitter: ""This #job might be a great fit for you: Supervisor/Floor Manager (m/w) in Teilzeit 20- 30 h/ Woche - https://t.co/5vC0k6YLU5 #LEGO #Retail #München #Hiring #CareerArc""","In deinem Browser ist JavaScript deaktiviert. Möchtest du mit dem klassischen Twitter weitermachen? Ja Hier ist die URL für diesen Tweet. Einfach kopieren und mit Freunden teilen. Auf deiner Timeline findest du in Echtzeit die Informationen, die dir wichtig sind. Um einem Account zu entfolgen, Cursor zum Profilbild bewegen und Folgen-Button klicken. Wenn du einen Tweet siehst, den du magst, dann klicke das Herz und zeige damit dem Verfasser, dass dir der Tweet gefällt. Der schnellste Weg, den Tweet eines anderen mit deinen Followern zu teilen, ist ein Retweet. Tippe auf das Symbol, um ihn sofort zu retweeten. Teile deine Gedanken zu einem Tweet ganz einfach in einer Antwort mit. Finde ein Thema, das dich interessiert, und leg direkt los. Erhalte einen aktuellen Überblick, worüber sich andere zur Zeit unterhalten. Folge mehr Accounts, um sofort Updates zu Themen zu bekommen, die dir wichtig sind. Sieh sofort die neuesten Unterhaltungen zu jedem Thema. Lass dir keine der besten Geschichten entgehen, während sie passieren.  Zurück zum Anfang ↑",90.2964150542
https://t.co/XVHDqb9uia,IESE zum vierten Mal in Folge weltweit die Nummer eins | Hochschulen und Forschung - Nachrichten,"""Unsere 110 Professoren leisten im Classroom, was wir 'Complexity made operationable' nennen"", erläutert Dean Prof. Dr. Franz Heukamp. IESE verstehe sich seit den Anfängen ""als Vorreiter in der Manager-Ausbildung mit Fokus auf die speziellen Ansprüche von Topmanagern und High-Potentials, die keine Zeit zu verlieren haben und greifbare Ergebnisse erwarten"". Original-Content von: IESE Business School, übermittelt durch news aktuell",55.7808905235
https://t.co/dZtLxCxZSb,Erneuter Primetime-Sieg: RTL II-Sozialreportage unterstreicht Relevanz (FOTO) | Fernsehen und Rundfunk - Nachrichten," Im Anschluss unterstrich eine neue Folge von ""Die Gruppe - Schrei nach Leben"" den erfolgreichen Primetime-Auftakt der Sozialreportage: 8,0 % MA (14-49 Jahre) und starke 11,7 % MA (14-29 Jahre) standen für die Dokumentation zu Buche. Erfolgreich zeigte sich bereits der Vorabend bei RTL II: ""Köln 50667"" erzielte 10,7 % MA (14-49 Jahre) und 12,3 % MA bei den jungen Zuschauern (14-29 Jahre). Im Anschluss erreichte ""Berlin - Tag &amp; Nacht"" 8,7 % MA (14-49 Jahre) und 12,6 % MA bei den 14-29-Jährigen. Insgesamt erzielte RTL II gestern einen Tagesmarktanteil von 7,0 % (14-49 Jahre). Original-Content von: RTL II, übermittelt durch news aktuell",78.798415212
https://t.co/G9ZvWYhSfr,Internetanbieter verlangen bis zu 70 Euro für Vertragsmitnahme beim Umzug (FOTO) | Energie & Rohstoffe - Nachrichten,"Ziehen Verbraucher um und nehmen ihren vorhandenen Internetvertrag mit, zahlen sie dafür bei den gängigsten Anbietern einmalig zwischen 40 und 70 Euro. Bei keinem der neun betrachteten DSL- und Kabelanbieter ist die Vertragsmitnahme kostenlos. Je nach Anbieter muss der Umzug zwischen 14 Tagen und drei Monaten im Voraus gemeldet werden. ""Auch bei einem Sonderkündigungsrecht lohnt es sich frühzeitig auf seinen Provider zuzugehen. Manche Anbieter entlassen Verbraucher auf Nachfrage früher aus ihrem Vertrag"", sagt Biebrich. Eine weitere Möglichkeit den laufenden Vertrag abzugeben, ist die Umschreibung auf einen Nachmieter. Zwei Anbieter bieten diese Option sogar kostenlos an, nur ein einziger schließt das grundsätzlich aus. Mitnahme der Rufnummer zu einem neuen Anbieter kostet bis zu 30 Euro Entscheiden sich Internetkunden für einen Wechsel des Anbieters - mit oder ohne Umzug - und wollen ihre alte Rufnummer mitnehmen, kostet das je nach Anbieter zwischen acht und 30 Euro. Ziehen Verbraucher mit bestehendem Vertrag um, wird die Rufnummer automatisch auf den neuen Anschluss übertragen. Möglich ist die Portierung der Rufnummer allerdings nur innerhalb desselben Vorwahlgebiets. Vergleichsportale fördern den Wettbewerb zwischen Anbietern von Internettarifen - dadurch sinkt der Preis. So sparen Verbraucher durch den Wechsel innerhalb eines Jahres durchschnittlich 352 Euro. Das ergab eine repräsentative Studie der WIK-Consult, einer Tochter des Wissenschaftlichen Instituts für Infrastruktur und Kommunikationsdienste (WIK).** Kunden, die Fragen zum passenden Internettarif haben, erhalten bei den CHECK24-Experten eine persönliche Beratung per Telefon oder E-Mail. Die spezialisierten Berater sind an sieben Tagen die Woche erreichbar. Über CHECK24 CHECK24 ist Deutschlands größtes Vergleichsportal. Der kostenlose Online-Vergleich zahlreicher Anbieter schafft konsequente Transparenz und Kunden sparen durch einen Wechsel oft einige hundert Euro. Privatkunden wählen aus über 300 Kfz-Versicherungstarifen, über 1.000 Strom- und über 850 Gasanbietern, mehr als 30 Banken, über 250 Telekommunikationsanbietern für DSL und Mobilfunk, über 5.000 angeschlossenen Shops für Elektronik, Haushalt und Autoreifen, mehr als 150 Mietwagenanbietern, über 1.000.000 Hotels, mehr als 700 Fluggesellschaften und über 90 Pauschalreiseveranstaltern. Die Nutzung der CHECK24-Vergleichsrechner sowie die persönliche Kundenberatung an sieben Tagen die Woche ist für Verbraucher kostenlos. Von den Anbietern erhält CHECK24 eine Vergütung. Das Unternehmen CHECK24 beschäftigt gut 1.000 Mitarbeiter gruppenweit mit Hauptsitz in München. Original-Content von: CHECK24 GmbH, übermittelt durch news aktuell",86.1837457962
https://t.co/KW6pOErV2a,"Druckfrisch - Neue Bücher mit Denis Scheck
Am Sonntag, 27. Mai 2018, um 23:35 Uhr mit Philip Roths letztem Interview für das deutsche Fernsehen | Literatur - Nachrichten","Philip Roth - Das letzte Interview für das deutsche Fernsehen Im Sommer 2011 besuchte das ""Druckfrisch""-Team Philip Roth in New York - wenige Monate, bevor der Autor sich entschloss, mit dem Schreiben aufzuhören. Es wurde ein Gespräch über die großen Themen seines Lebens: Männer und Frauen, das Verhältnis zum Vater, die Kraft oder die Ohnmacht der Literatur. Am 22. Mai 2018 ist Philip Roth - Daueranwärter auf den Nobelpreis - gestorben. Wir zeigen das Interview erstmals in ausführlicher Länge. Und last not least kommentiert Denis Scheck die aktuelle SPIEGEL-Bestsellerliste Sachbuch. ""Druckfrisch"" im Internet: DasErste.de/druckfrisch Original-Content von: ARD Das Erste, übermittelt durch news aktuell",74.3052817307
https://t.co/vdNAbFDQqC,Welt-MS-Tag: Multiple Sklerose - Eine Krankheit im Wandel | Medizin - Nachrichten,"Die Zahl der Menschen mit der Diagnose Multiple Sklerose (MS) nimmt in Industrieländern stetig zu. Allein in Deutschland sind es 240.000 - eine Verdopplung in den vergangenen 40 Jahren. Die neurologische Erkrankung ist zwar immer besser therapier-, aber immer noch nicht heilbar. Die Behandlung der MS hat sich seit den 1990er Jahren stark verändert. Die Gründe: Bessere und frühere Diagnosen und Medikamente, die den Krankheitsverlauf verändern können. Die Deutsche Multiple Sklerose Gesellschaft (DMSG) begeht den diesjährigen Welt-MS-Tag am 30. Mai unter dem Motto ""Unheilbar optimistisch"". Weitere Artikel zum Thema ""Multiple Sklerose"" finden Sie auf Pharma Fakten: Pharma Fakten-Grafik - Multiple Sklerose: Je früher in die Therapie, desto besser Die Erkrankung Multiple Sklerose (MS) tritt deutlich häufiger auf als bisher angenommen. Das geht aus einem Bericht des Versorgungsatlas, eine Einrichtung des Zentralinstituts für die kassenärztliche Versorgung (Zi), hervor. Original-Content von: PHARMA FAKTEN, übermittelt durch news aktuell",77.7606295612
https://t.co/olKDODnOrK,Erneuter Primetime-Sieg: RTL II-Sozialreportage unterstreicht Relevanz | Fernsehen und Rundfunk - Nachrichten," Im Anschluss unterstrich eine neue Folge von ""Die Gruppe - Schrei nach Leben"" den erfolgreichen Primetime-Auftakt der Sozialreportage: 8,0 % MA (14-49 Jahre) und starke 11,7 % MA (14-29 Jahre) standen für die Dokumentation zu Buche. Erfolgreich zeigte sich bereits der Vorabend bei RTL II: ""Köln 50667"" erzielte 10,7 % MA (14-49 Jahre) und 12,3 % MA bei den jungen Zuschauern (14-29 Jahre). Im Anschluss erreichte ""Berlin - Tag &amp; Nacht"" 8,7 % MA (14-49 Jahre) und 12,6 % MA bei den 14-29-Jährigen. Insgesamt erzielte RTL II gestern einen Tagesmarktanteil von 7,0 % (14-49 Jahre).",73.2881497701
https://t.co/s1vOHWGa7l,"""Köln 50667"" überzeugt dauerhaft am Vorabend | Fernsehen und Rundfunk - Nachrichten"," - ""Köln 50667"" acht Tage in Folge über 10 % MA (14-49 Jahre) - Erfolgreichste Strecke seit März 2014 Auch im sechsten Jahr der Ausstrahlung bleibt ""Köln 50667"" ein Erfolg: Die RTL II-Vorabendsoap erzielte am gestrigen Mittwoch mit 10,4 % (16,6 % MA 14-29 Jahre) zum achten Mal in Folge zweistellige Marktanteile in der werberelevanten Zielgruppe der 14-49-Jährigen. Das ist die erfolgreichste Strecke für das Format seit März 2014. Hintergrund sind die aktuellen Story-Highlights der Soap aus der Domstadt: Während Lina kurz vor der Hochzeit mit ihrem Vergewaltiger steht, liegt Jule weiterhin im Koma und ringt mit dem Tod. Original-Content von: RTL II, übermittelt durch news aktuell",76.9489039716
https://t.co/edoisJquiJ,OLG München macht bei SKW den Weg frei für eine Alternative zum europarechtswidrigen Insolvenzplan; Hauptversammlung wechselt halben Aufsichtsrat aus und stellt Weichen zur Beseitigung der Insolvenz | Finanzmeldungen - Nachrichten,"Hintergrund: Zum weiteren Vorgehen: 1) Haircut der Banken: 2) Kapitalerhöhung: Über die MCGM [Management &amp; Capital Group] GmbH: Original-Content von: MCGM [Management & Capital Group] GmbH, übermittelt durch news aktuell",79.6594969455
https://t.co/yGgCXpRlKB,"⚡️ Owen auf Twitter: ""Holy crap, Instapaper is basically going dark in Europe with <24 hours notice because GDPR. 🙅‍♀️… ""","In deinem Browser ist JavaScript deaktiviert. Möchtest du mit dem klassischen Twitter weitermachen? Ja Hier ist die URL für diesen Tweet. Einfach kopieren und mit Freunden teilen. Auf deiner Timeline findest du in Echtzeit die Informationen, die dir wichtig sind. Um einem Account zu entfolgen, Cursor zum Profilbild bewegen und Folgen-Button klicken. Wenn du einen Tweet siehst, den du magst, dann klicke das Herz und zeige damit dem Verfasser, dass dir der Tweet gefällt. Der schnellste Weg, den Tweet eines anderen mit deinen Followern zu teilen, ist ein Retweet. Tippe auf das Symbol, um ihn sofort zu retweeten. Teile deine Gedanken zu einem Tweet ganz einfach in einer Antwort mit. Finde ein Thema, das dich interessiert, und leg direkt los. Erhalte einen aktuellen Überblick, worüber sich andere zur Zeit unterhalten. Folge mehr Accounts, um sofort Updates zu Themen zu bekommen, die dir wichtig sind. Sieh sofort die neuesten Unterhaltungen zu jedem Thema. Lass dir keine der besten Geschichten entgehen, während sie passieren. There should be a wall of shame for this stuff somewhere. If you're going dark after two years of notice, I have questions. Yep :-\ We are actively working on a resolution – sorry for the inconvenience, Owen. Hm, I don't get why this is happening when a) you don't need to comply BY Friday, you just need a plan and B) this was announced two years ago? Yeah... I can't comment on specifics other than to say that I'm actively working on resolving it. Sorry. :-\ This is a bummer, however I really appreciate the hard work over the years! Thanks – hope to be back soon Owen, working hard on it. what the fuck shady shit are they doing that they’re *that* worried? :/ I mean unroll I could understand… but instapaper? I have questions I was reading the privacy policy and the data must be going somewhere (maybe Pinterest and beyond) which would be bad for gdpr Sorry to say that it is real. We are actively working on bringing the service back online for residents in Europe, and we intend to restore access as soon as possible Do they know GDPR applies to all European citizens, regardless of where they reside? Can’t they just ask if it is okay to do store data? It is my, very limited understanding, that if they ask permission it is okay. They can't make a blanket acceptance a requirement to use them, only the data they actually need, and they have to be able to explain to you what they're doing with your data. If any company says that's too hard, they're up to no good.  Zurück zum Anfang ↑",90.5992298933
https://t.co/qO0d5JUwx2,Bayernpartei: BAMF-Skandal - etablierte Politik im Selbstschutzmodus | Politik - Nachrichten,"Harold Amann, Landespressesprecher Original-Content von: Bayernpartei, übermittelt durch news aktuell",65.7258049787
https://t.co/rh5irs5Wv3,"GRIP - Das Motormagazin: ""JP Kraemer checkt den BMW i8 Roadster"" (FOTO) | Auto & Verkehr - Nachrichten","Sendetermin: Sonntag, 27. Mai 2018, um 18:00 Uhr bei RTL II Mallorca im Frühling - das perfekte Terrain, um ""oben ohne"" zu fahren. Fünf Jahre nach dem i8 Coupé schickt BMW die Roadster-Variante des Hybridsportlers auf die Straße. Mit verbesserter Akkutechnik und stärkerem Elektromotor kann das Cabrio 53 Kilometer weit rein elektrisch fahren - das Ganze zum Einstiegspreis von 155.000 Euro. JP Kraemer checkt, ob der i8 Roadster tatsächlich der Sportwagen der Zukunft ist. Zuschauerin Ramona sucht einen spritzigen Stadtflitzer, der zugleich ein hübsches Cabrio ist - ein ""Minicabrio"" sozusagen. Ramona hat nicht viel Geld zur Verfügung: Mehr als 5.000 Euro darf der offene Fahrspaß nicht kosten. GRIP-Gebrauchtwagenexperte Det Müller findet einen Ford Streetka, einen Opel Tigra und einen Smart Roadster. Ist der passende Flitzer für Ramona dabei? GRIP bei der Neuauflage der renommierten Oldie- und Youngtimer-Auktion im schweizerischen Toffen: Bei der großen Frühjahrsversteigerung kommen insgesamt 93 Traumautos unter den Hammer. Das Besondere: Viele davon werden ohne Mindestpreis angeboten. Das lockt gerade die Schnäppchenjäger an. Aber ob sie auch tatsächlich zu ihrem Traumwagen kommen? ""GRIP - Das Motormagazin"" am 27. Mai 2018 um 18:00 Uhr bei RTL II Über ""GRIP - Das Motormagazin"": Seit zehn Jahren und in über 400 Sendungen bietet ""GRIP - Das Motormagazin"" seinen Zuschauern sonntags um 18:00 Uhr bei RTL II kompetenten Motorjournalismus vereint mit Tests der Superlative. Mit viel Humor, einem hochwertigen Look und außergewöhnlichen Themen verbindet ""GRIP - Das Motormagazin"" Unterhaltung rund um die Motorwelt mit Service für den Verbraucher. Moderator Matthias Malmedie und sein Team zeigen jede Woche die heißesten Auto-Trends, wagen rasante Versuche und geben kompetente Tipps. Original-Content von: RTL II, übermittelt durch news aktuell",83.4985775459
https://t.co/vVKQH3FTKP,"Das Erste: ""hart aber fair"" 
am Montag 28. Mai 2018, 21:00 Uhr, live aus Berlin | Programmankündigungen - Nachrichten","Das Thema: Mieten zu hoch, Bauen zu teuer - wenn Wohnen arm macht! In Städten und Boom-Regionen explodieren die Mieten. Warum sind Wohnungen vielerorts Mangelware? Muss der Staat die Mieter stärker vor Spekulanten schützen? Und auch Vorschriften kippen, die Bauen und Wohnen unerschwinglich machen? Redaktion: Markus Zeidler (WDR) Original-Content von: ARD Das Erste, übermittelt durch news aktuell",76.7788565057
