source,Headline,Body,Relevancy
https://t.co/7SUDvYckdw,Urlaubsbarometer 2018 / Globale Umfrage: Die Reiselust der Deutschen steigt wieder stark an /  Vollere Urlaubskasse und gesunkene Terrorangst (FOTO) | Versicherungen und Vorsorge - Nachrichten,"- Besorgniserregender Trend: Absicherung medizinischer Notfälle im Ausland wird unwichtiger - Globale Unterschiede: Europäer wollen vor allem relaxen, Chinesen lernen und Sport treiben - Fernweh: Urlaub im Ausland ist bei den Europäern wieder stärker gefragt. Die paneuropäische Fußball EM in zwei Jahren ist als Ziel noch attraktiver als die WM 2018 Auch die Urlaubskasse ist besser gefüllt. Deutsche planen im Durchschnitt 2.376 EUR für den Sommerurlaub ein. 3 Prozent mehr als im Jahr zuvor, damit liegen sie fast 420 EUR über dem europäischen Durchschnitt. Noch größere Sprünge im Vergleich zum Vorjahr machen die Befragten in Österreich (+ 9 Prozent; 2.645 EUR), in der Schweiz (+ 9 Prozent; 2.710 EUR) und insbesondere - ein Jahr nach der Brexit-Entscheidung - in Großbritannien (+ 23%; 2.230 EUR). Trotzdem bleiben die Europäer preisbewusst: Für 52 Prozent ist das Budget der entscheidende Faktor bei der Auswahl des Reiseziels, erst danach folgt das Klima mit 48 Prozent. ""Die Menschen reagieren sehr sensibel auf politische Situationen. Das spüren wir als Reiseversicherer unmittelbar am Telefon oder anhand der Abrufe unserer Online-Reiseinformationen"", sagt Peter Georgi, CEO Europ Assistance Deutschland. ""Ich freue mich, dass die Befragung ein aktuell optimistischeres Bild zeigt. Trotzdem bleibt es für Versicherer ein Muss, den Terrorschutz als Standard mit in den Versicherungspaketen zu verankern."" Besorgniserregender Trend: Absicherung medizinischer Notfälle im Ausland wird unwichtiger Für Europa insgesamt bleibt die Reisekrankenversicherung neben der Autoversicherung das wichtigste Paket, das es abzusichern gilt (jeweils 65 Prozent). Und auch für die Reisewilligen in den USA (70 Prozent), in Brasilien (58 Prozent), Indien (75 Prozent) und China (81 Prozent) ist die Absicherung des medizinischen Notfalls wichtiger als den Deutschen. ""Eine Auslandsreisekrankenversicherung für das ganze Jahr kostet kaum mehr als ein Fast-Food-Burger-Menü"", sagt Peter Georgi. ""Gut investiertes Geld, wir bekommen täglich mehrere Dutzend Notrufe. Die Kosten können bei 50.000 EUR und darüber liegen - und die nationale Krankenversicherung übernimmt davon meist keinen Cent."" Wenn es um die Frage geht, bei welcher Institution die Deutschen ihre Reiseversicherung abschließen, vertrauen immer mehr Menschen ihrem Versicherungsunternehmen (60 Prozent). Damit liegen sie weit über dem europäischen Durchschnitt (48 Prozent). In den USA sind es gerade einmal 22 Prozent, US-Amerikaner versichern sich für ihre Reise lieber über ihr Kreditkarten-Unternehmen (36 Prozent). Globale Unterschiede: Europäer wollen vor allem relaxen, Chinesen lernen und Sport treiben Für 54 Prozent der Europäer ist Erholung das wichtigste im Urlaub. 44 Prozent der Befragten wollen vor allem Zeit mit Familie und Freunden verbringen, gerade einmal 10 Prozent begeistern sich für Sport im Urlaub. Bei allem Verlangen nach entspannten Ferien gelingt es jedoch nur 66 Prozent der Europäer, im Urlaub von der Arbeit abzuschalten, 20 Prozent lesen E-Mails, 10 Prozent antworten sogar. Deutschland bildet bezüglich Work-Life-Balance keine Ausnahme: Knapp ein Drittel (32 Prozent) bekommt auch während des Urlaubs den Job nicht aus dem Kopf. Chinesen legen in ihrer Freizeit weniger Wert auf Entspannung: Gerade einmal ein Viertel möchte sich im Urlaub erholen, nur 40 Prozent der Befragten schalten vom Job ab. Am liebsten entdecken die Menschen aus dem Reich der Mitte neue Kulturen (39 Prozent) oder nutzen die Zeit zum Lesen und Lernen (31 Prozent). Mit 30 Prozent wird es für Chinesen immer wichtiger, im Urlaub Sport zu treiben. Unterschiede auch bei der Urlaubsplanung: 49 Prozent der Deutschen buchen mehr als vier Monate vor der Reise, in China sind es nur 19 Prozent. Für ihre Entscheidung vertrauen die Chinesen zu 51 Prozent auf Online-Bewertungen - in Deutschland sind es nur 22 Prozent (4 Prozent weniger als im Vorjahr). Insgesamt sind die befragten Menschen in den Nicht-EU-Ländern abenteuerlustiger als die Europäer: In der Wildnis campen, die Wohnungen mit anderen tauschen, eine Weltreise erleben - das ist nur für 53 Prozent der Europäer ein Ziel. Etwas Neues ausprobieren wollen dagegen 74 Prozent der Chinesen, 70 Prozent der Brasilianer und Inder. In den USA sind es immerhin noch 67 Prozent. Diese Einstellung spiegelt sich auch in der Wahl des Reiselandes wider. Europäer zieht es - ganz anders als die Menschen in Nicht-EU-Ländern - in erster Linie dorthin, wo sie schon einmal waren (33 Prozent). Fernweh: Urlaub im Ausland ist bei den Europäern wieder stärker gefragt Durchweg höheres Interesse zeigen die Europäer an der in zwei Jahren in 12 europäischen Städten stattfindenden Fußball EM. In Deutschland können sich 37 Prozent, in Polen 48 Prozent und in Portugal sogar 50 Prozent vorstellen, mit dabei zu sein. Über die Studie ""Europ Assistance Urlaubsbarometer 2018"" Über die Europ Assistance Gruppe Original-Content von: Europ Assistance, übermittelt durch news aktuell",90.2262919366
https://t.co/JPWl2YFEnt,"e-Laden - noch zu wenig Kundenservice / Der ADAC hat erstmals öffentliche e-Ladesäulen getestet / Technisch in Ordnung, aber Schwächen bei Bedienkomfort, Information und Preistransparenz (FOTO) | Auto & Verkehr - Nachrichten","Mängel fanden sich vor allem bei der Preistransparenz. Der Betreiber-Preis pro Einheit war meist nicht auf der Ladesäule angegeben, sondern nur über das Internet oder eine App in Erfahrung zu bringen, ebenso der pro Ladung zu zahlende Betrag. Bei zehn Stationen hatte der Kunde überhaupt keinen Überblick über die angefallenen Kosten und musste auf die Rechnung warten. ""Das Laden an einer e-Ladesäule muss so komfortabel und bequem sein wie an einer herkömmlichen Zapfsäule. Dazu gehört, dass der Verbraucher vor dem Laden weiß, was der Strom kostet, und nach dem Ladevorgang, wie hoch seine tatsächliche Rechnung ist"", so Ulrich Klaus Becker, ADAC Vizepräsident für Verkehr. Auch wer spontan Strom tanken will, kann das derzeit nicht überall. Bei zwölf Stationen war das Laden ad hoc ohne irgendeine Zugangsberechtigung nicht möglich. Wer auf den Internetseiten der Betreiber nach genauen Informationen sucht, wird vor allem bei den Angaben zur technischen Ausstattung der Säulen nicht immer fündig. Hier fehlten nicht selten die Daten zur Ladeleistung. Die Adressen waren meist richtig angegeben, dennoch mussten die Tester oft suchen. Denn zwei Drittel der Ladesäulen waren im Straßenraum nur schlecht zu erkennen. Viele Parkplätze waren eher klein oder nahe am fließenden Verkehr. ""Die Betreiber von Ladesäulen und die Genehmigungsbehörden sind gefordert, für eine bessere Sichtbarkeit der Säulen zu sorgen. Wünschenswert ist eine Wiedererkennbarkeit für alle Verbraucher in ganz Deutschland analog den Tankstellen für konventionelle Kraftstoffe"", so Becker weiter. Diese Presseinformation finden Sie online unter presse.adac.de. Folgen Sie uns auch unter twitter.com/adac Original-Content von: ADAC, übermittelt durch news aktuell",75.8832536967
https://t.co/sIuOnfRAwe,We made an iPhone app for those who have too many photos,"An average iPhone user takes an astounding 10,000 photos every year. And while we just made that up, the truth is people do take a lot of photos with their iPhones. Christmas dinners with in-laws, backpacking trips to South America, silly concert selfies — you know, memories. But photos have a way of piling up, and the next thing you know your iPhone’s brimming with them like a shopaholic's closet. The app finds blurred photos, screenshots, and photos of text you probably forgot to delete, so you can trim some weight off your library just by clearing those. Moreover, true to its name, Gemini Photos detects photos that look alike — you know how sometimes you take several shots to pick a good one later? Using a smart algorithm, the app suggests you the best result in a set of similar photos and lets you quickly delete the rest. As a bonus feature, it even lets you delete your entire library if you need to (you’d have to select every pic manually to do that in Photos). Gemini Photos works on iOS 11 and is free with in-app purchases. You’ll be able to clear unlimited blurred photos and clutter, while sorting out similar photos will cost you some extra.",66.830671927
https://t.co/68qz8UFg8v,"Das Erste: ANNE WILL am 27. Mai 2018 um 21:45 Uhr im Ersten: 
Die Bremer Asyl-Affäre - Systemfehler oder Einzelfall? | Politik - Nachrichten","Zu Gast bei Anne Will: ANNE WILL - politisch denken, persönlich fragen Original-Content von: ARD Das Erste, übermittelt durch news aktuell",65.1387621582
